title,url,news maker
All the areas of England moving into Tier 3 from midnight on Wednesday,https://c.newsnow.co.uk/A/1058817266?-53340:40617,Mirror.co.uk
London Tier 3: The areas of Essex and Hertfordshire also going into Tier 3 from Wednesday,https://c.newsnow.co.uk/A/1058818081?-53340:40617,My London
Zayn Malik's sister's 40-guest wedding 'broken up by POLICE' for flouting Tier 3 rules,https://c.newsnow.co.uk/A/1058833508?-53340:40617,Mail Online
Covid rules: What can I do under tier 3 restrictions in England?,https://c.newsnow.co.uk/A/1058829628?-53340:40617,BBC
How much are schoolchildren driving London's latest coronavirus spike?,https://c.newsnow.co.uk/A/1058834551?-53340:40617,Sky News
"Newer, faster Covid strain sends London on 'highest alert' WHO to probe variant",https://c.newsnow.co.uk/A/1058830954?-53340:40617,India Today
